기관,발행일,제목,링크,수집일
백악관(White House),2026-01-29,Lab Leak: The True Origins of Covid-19,https://www.whitehouse.gov/lab-leak-true-origins-of-covid-19/,2026-01-29
백악관(White House),2026-01-29,January 6: A Date Which Will Live in Infamy,https://www.whitehouse.gov/j6/,2026-01-29
백악관(White House),2026-01-29,Arrested: Worst of the Worst,https://www.dhs.gov/wow,2026-01-29
백악관(White House),2026-01-29,Criminal Aliens Receiving Medicaid,https://www.whitehouse.gov/criminals/,2026-01-29
백악관(White House),2026-01-29,Briefings & Statements,https://www.whitehouse.gov/briefings-statements/,2026-01-29
